exam_set_id,subject,year,grade,session,syllabus,question_paper_file_name,memo_file_name,group_id,group_title,group_instructions,question_id,parent_id,question_text,marks,scenario,context,options,match_data,guide_table,memo_question_text,marker_instruction,model_answers,sub_answers,essay_structure,memo_structured_answer,memo_marks,memo_max_marks,memo_notes,memo_topic
a8c8ee34-220d-4f36-8178-95c3c8594409,English Language and Literature (EMC),2019,A Level,MAY/JUNE,OCR A Level,OCR-A-Level-English-Language-and-Literature-Paper-2-QP.pdf,OCR-A-Level-English-Language-and-Literature-Paper-2-MS.pdf,QUESTION 2,Section A – Poetry: stylistic analysis,Answer one question from this section. You should spend about one hour on this section.,2,,"Explore how Emily Dickinson presents ideas and feelings about striving for freedom in ‘The Soul has Bandaged Moments’ and make connections with one or two other poems from your collection.

You should consider Dickinson’s use of poetic and stylistic techniques and significant literary or other relevant contexts.",32,"‘The Soul has Bandaged Moments’

The Soul has Bandaged moments –
When too appalled to stir –
She feels some ghastly Fright come up
And stop to look at her –

Salute her – with long fingers –
Caress her freezing hair –
Sip, Goblin, from the very lips
The Lover – hovered – o’er –
Unworthy, that a thought so mean
Accost a Theme – so – fair –

The soul has moments of Escape –
When bursting all the doors –
She dances like a Bomb, abroad,
And swings upon the Hours,

As do the Bee – delirious borne –
Long Dungeoned from his Rose –
Touch Liberty – then know no more,
But Noon, and Paradise –

The Soul’s retaken moments –
When, Felon led along,
With shackles on the plumed feet,
And staples, in the Song,

The Horror welcomes her, again,
These, are not brayed of Tongue –",,,,,Explore how Dickinson presents ideas and feelings about striving for freedom in ‘The Soul has Bandaged Moments (512)’,,"[""Voice and Tone: Continuous present tense, 3rd person description of the intense experience of bursting free from restraint; the aftermath of this is addressed in stanza 5 and the last two lines."", ""Form, Structure and Graphology: 5 stanzas and ‘a half’. The last two lines graphically suggest the soul’s reimprisonment, cutting it off from any hope of further escape. Characteristic incomplete, fragmented sentence and use of hyphens to denote clauses, along with Dickinson’s regular use of 4/3/4/3 hymn meter. Elongation of stanza 2 suggests her paralysis and balances the truncated stanza 6."", ""Imagery and Symbolism: Ambiguity of ‘bandaged’, suggesting healing, restraint or death (e.g. Egyptian mummies). Gothic overtones through ‘the Horror’, the ‘Fright’ and ‘Goblin’. Inability to move contrasted with the equally destructive energy of escape: ‘burst’, ‘danced like a bomb’. Analogy of the bee and the rose: the rose is beloved by the bee and can’t escape it; she can’t escape the lover or ‘Horror’. The excessive intensity of escape leads to recapture and imprisonment: the soul is personified as a ‘felon’ and a ‘shackled’ bird whose song has been cut off, contrasting with ‘brayed’."", ""Rhyme and Rhythm: Characteristic use of slant rhymes in 2nd/4th lines, repeated throughout, ending with a half rhyme in the final two lines suggesting unfinished/ongoing cycle of restraint and escape. Unusual internal rhyme in final lines of stanza 2 (mean/theme) disrupts the rhythm, breaking her paralysis and anticipating the escape."", ""Lexis: Imprisonment, entrapment, restraint, escape, release, liberty, nature, crime, guilt, the Gothic, supernatural, terror, love, emotion, destruction."", ""Grammar and Morphology: 1 unfinished sentence, characteristically punctuated with hyphens, which serve to separate and emphasise the images, forcing re-evaluation. Occasional use of commas to emphasise the horror of the Goblin (stanza 2) her liberty ‘abroad’ (stanza 3) and recapture and restriction in stanza 5."", ""Context (AO3): One of several poems which explore the culturally passive role of women in society."", ""Context (AO3): Use of hymn meter to explore inequality in relationships and the expected submissiveness of women; the influence of Gothic literature is evident."", ""Connections (AO4): ‘My Life had stood – a Loaded Gun’ (754) and ‘One Need not be a Chamber – to be Haunted’ (670).""]",,,,32,,,
a8c8ee34-220d-4f36-8178-95c3c8594409,English Language and Literature (EMC),2019,A Level,MAY/JUNE,OCR A Level,OCR-A-Level-English-Language-and-Literature-Paper-2-QP.pdf,OCR-A-Level-English-Language-and-Literature-Paper-2-MS.pdf,QUESTION 3,Section A – Poetry: stylistic analysis,Answer one question from this section. You should spend about one hour on this section.,3,,"Explore how Seamus Heaney presents childhood memories and discoveries in ‘Death of a Naturalist’ and make connections with one or two other poems from your collection.

You should consider Heaney’s use of poetic and stylistic techniques and significant literary or other relevant contexts.",32,"‘Death of a Naturalist’

All year the flax-dam festered in the heart
Of the townland; green and heavy-headed
Flax had rotted there, weighted down by huge sods.
Daily it sweltered in the punishing sun.
Bubbles gargled delicately, bluebottles
Wove a strong gauze of sound around the smell.
There were dragonflies, spotted butterflies,
But best of all was the warm thick slobber
Of frogspawn that grew like clotted water
In the shade of the banks. Here, every spring
I would fill jampotfuls of the jellied
Specks to range on window-sills at home,
On shelves at school, and wait and watch until
The fattening dots burst into nimble Swimming tadpoles. Miss Walls would tell us how
The daddy frog was called a bullfrog
And how he croaked and how the mammy frog
Laid hundreds of little eggs and this was
Frogspawn. You could tell the weather by frogs too
For they were yellow in the sun and brown
In rain.

Then one hot day when fields were rank
With cowdung in the grass the angry frogs
Invaded the flax-dam; I ducked through hedges
To a coarse croaking that I had not heard
Before. The air was thick with a bass chorus.
Right down the dam gross-bellied frogs were cocked
On sods; their loose necks pulsed like sails. Some hopped:
The slap and plop were obscene threats. Some sat
Poised like mud grenades, their blunt heads farting.
I sickened, turned, and ran. The great slime kings
Were gathered there for vengeance and I knew
That if I dipped my hand the spawn would clutch it.",,,,,Explore how Heaney presents childhood memories and discoveries in ‘Death of a Naturalist’.,,"[""Voice and Tone: 1st person narration of childhood memory from adult perspective. Child’s voice evident when recounting what ‘Miss Wall’ said, contrasting with increasing menace in stanza 2, articulated through ‘adult’ complex constructs."", ""Form: 2 stanzas, blank verse contrasting childish wonder of the natural world with adult recollection of the angry frogs. Some enjambment, particularly in second half of stanza 1, suggesting enthusiasm. The extremely uneven share line between stanzas (2/8) signals the volta: abrupt break between comforting childhood ritual/memory and frightening encounter with the adult frogs."", ""Imagery and Symbolism: Vivid evocation of unappealing aspects of natural world (ugly, oppressive, smelly) contrasts with range of wildlife/insects found there and childhood enthusiasm. Contrast between scale of the flax dam ‘weighed down’ and delicacy of the bubbles. Contrast between childhood excitement/enthusiasm and the menace of the adult frogs: Childishness of ‘Mammy frog’ suggest relatively young age of the narrator. Similes/metaphors used to convey threat of attack e.g. ’pulsed like sails’ and ‘mud grenades’. Subversion of sound to convey revulsion – ‘croaking’ becomes ‘farting’."", ""Rhyme and Rhythm: Blank verse, unrhymed, mostly iambic pentameter. Occasional alliteration and anaphora used for emphasis e.g. ‘wait and watch’ (anticipation) or ‘Some hopped…some sat’ (building threat)."", ""Lexis: Words associated with nature, insects, wildlife, frogs, tadpoles, plants, reproduction, childhood, school, memories, fear, escape threat, attack, military, sound, singing."", ""Grammar and Morphology: Characteristic long, controlled sentences. Past tense, some use of the first personal pronoun. Relatively long sentences in stanza one with little internal punctuation suggesting childhood enthusiasm. Stanza 2 is tighter, underscoring the threat/narrator’s fear. Rule of 3 verb list in line 31 intensifies the revolted, fearful reaction, simultaneously disrupting the iambic rhythm."", ""Context (AO3): one of several explorations of childhood memory."", ""Context (AO3): Irish poetry dwelling on the relationships of people with the landscape and their place within it."", ""Connections (AO4): ‘Churning Day’, and ‘The Toome Road’.""]",,,,32,,,
a8c8ee34-220d-4f36-8178-95c3c8594409,English Language and Literature (EMC),2019,A Level,MAY/JUNE,OCR A Level,OCR-A-Level-English-Language-and-Literature-Paper-2-QP.pdf,OCR-A-Level-English-Language-and-Literature-Paper-2-MS.pdf,QUESTION 4,Section A – Poetry: stylistic analysis,Answer one question from this section. You should spend about one hour on this section.,4,,"Explore how Eavan Boland presents ideas and attitudes towards the rituals of household work in ‘Woman in Kitchen’ and make connections with one or two other poems from your collection.

You should consider Boland’s use of poetic and stylistic techniques and significant literary or other relevant contexts.",32,"‘Woman in Kitchen’

Breakfast over, islanded by noise,
she watches the machines go fast and slow.
She stands among them as they shake the house.
They move. Their destination is specific.
She has nowhere definite to go:
she might be a pedestrian in traffic.

White surfaces retract. White
sideboards light the white of walls.
Cups wink white in their saucers.
The light of day bleaches as it falls
on cups and sideboards. She could use
the room to tap with if she lost her sight.

Machines jigsaw everything she knows.
And she is everywhere among their furor:
the tropic of the dryer tumbling clothes.
The round lunar window of the washer.
The kettle in the toaster is a kingfisher
swooping for trout above the river’s mirror.

The wash done, the kettle boiled, the sheets
spun and clean, the dryer stops dead.
The silence is a death. It starts to bury
the room in white spaces. She turns to spread
a cloth on the board and irons sheets
in a room white and quiet as a mortuary.",,,,,Explore how Boland presents ideas and attitudes towards the rituals of household work in ‘Woman in Kitchen’.,,"[""Voice: 3rd person narrative in the continuous present tense, suggesting detachment and emphasising the indifference of the appliances and the speaker’s limited, disenfranchised role."", ""Form: 4 stanzas of six lines of 8-12 syllables. Variable sentence lengths, most. Some enjambment in stanzas 2, 3 and 4."", ""Imagery and Symbolism: Repetition of ‘white’ creates an enclosed, clinical setting, and emphasises the automated processes. She is surrounded by machines: ‘jigsaw’ suggests ‘fitting together’ but it is also a precision tool. Striking metaphors of life in the outside world in stanza 3 contrast sharply with the setting. Dichotomy between the purposeful actions of the machines and the apparent redundancy of the woman. Imagery of death: personification of ‘silence’ actively ‘buries’ the room which becomes as quiet as a 'morgue'. Contrast between the noise made by the machines and the quiet in which the woman is able to work."", ""Rhyme and Rhythm: Variable rhyme scheme. Metre moves between iambs and trochees. The weak stress always falls on ‘she’, subordinating her to the machines. Internal rhyme in the final line."", ""Lexis: work, chores, kitchen appliances, colour, clinical, death, blindness, space, enclosure, travel, furniture, crockery, sounds."", ""Grammar and Morphology: Continuous present tense with variable sentence lengths. Contrast between tightly controlled sentences in stanza 1 and longer sentences in second half of stanza 3 and 4. Use of third person feminine pronoun to characterise the woman. Repetition of ‘white’ in stanza 2 and asyndeton in stanza 3. Statements to describe the machines in stanza 3, the first of which lacks a verb. (‘Round lunar window’)"", ""Context (AO3): One of several poems in the collection which explores the lives and roles of women."", ""Context (AO3): This fits into a wider tradition of poems which explore the customs and rituals of household work, particularly those linked with the traditional role of the female or mother figure."", ""Connections (AO4): ‘Degas’s Laundresses’ and ‘Painting Back from Market by Chardin’.""]",,,,32,,,
a8c8ee34-220d-4f36-8178-95c3c8594409,English Language and Literature (EMC),2019,A Level,MAY/JUNE,OCR A Level,OCR-A-Level-English-Language-and-Literature-Paper-2-QP.pdf,OCR-A-Level-English-Language-and-Literature-Paper-2-MS.pdf,QUESTION 5,Section A – Poetry: stylistic analysis,Answer one question from this section. You should spend about one hour on this section.,5,,"Explore how Carol Ann Duffy presents ideas and feelings about love and the natural world in ‘Write’ and make connections with one or two other poems from your collection.

You should consider Duffy’s use of poetic and stylistic techniques and significant literary or other relevant contexts.",32,"‘Write’

Write that the sun bore down on me,
kissing and kissing, and my face
reddened, blackened, whitened to ash,
was blown away by the passionate wind
over the fields, where my body’s shape
still flattened the grass, to end as dust
in the eyes of my own ghost.

Or write
that the river held me close in its arms, cold fingers
stroking my limbs, cool tongue probing my mouth,
water’s voice swearing its love love love in my ears,
as I drowned in belief.

Then write the moon
striding down from the sky in its silver boots
to kick me alive; the stars like a mob of light,
chanting a name, yours. Write your name on my lips
when I entered the dark church of the wood
like a bride, lay down for my honeymoon,
and write the night, sexy as hell, write the night
pressing and pressing my bones
into the ground.",,,,,Explore how Duffy presents ideas and feelings about love and the natural world in ‘Write’.,,"[""Voice: 1st person exploration of love and its intensely imagined interaction with the natural world. Continuous near past tense. Imperatives used to command the documentation the images."", ""Form: 3 stanzas of varying lengths. Shared, indented lines between stanzas suggests paragraphs, reflecting the title. Variable line lengths, 8-11 syllables. Extended, but fewer lines in stanza 2 suggests the river sandwiched between the landscapes depicted in stanzas 1 and 3. Some enjambment, most prominently in stanzas 1 and 3. Final hemistich emphasises symbolic death."", ""Imagery and Symbolism: Each stanza imagines becoming one with the elements, even being symbolically consumed by them, reflecting emotional intensity. The elements are personified as contrasting ‘characters’, most notably the river as a lover and the moon and stars as a thuggish mob. Suggestion of purification through fire and water."", ""Rhyme, Rhythm, phonology: No rhyme scheme, some half rhymes, implicit in stanza 1. Trochees and repetition create increasing urgency throughout."", ""Lexis: Words associated with love, loving, kissing, passionate encounters, weddings, sex, sun, heat, water, cold, night, moon and stars death, burial, burning and purification."", ""Grammar and Morphology: Stanza 1 and 2 are one sentence long, stanza 3 has two sentences; all have variable clause lengths. Continuous past tense which falters in the final sentence, moving from the present tense for the instruction to the past tense for the marriage description. Imperatives evident throughout (‘write’). Repetition of ‘love’ in stanza 2 simulates the ‘glug’ of drowning. Use of first and second pronouns to distinguish between the person instructed to ‘write’ and the first person experience."", ""Context (AO3): One poem in a collection tracing the development and ending of a love affair."", ""Context (AO3): This fits in with a wider tradition and literary heritage which connects the intensity of love with the energies of the natural world and also perceives love as a form of death."", ""Connections (AO4): ‘Answer’ and ‘Love’""]",,,,32,,,
a8c8ee34-220d-4f36-8178-95c3c8594409,English Language and Literature (EMC),2019,A Level,MAY/JUNE,OCR A Level,OCR-A-Level-English-Language-and-Literature-Paper-2-QP.pdf,OCR-A-Level-English-Language-and-Literature-Paper-2-MS.pdf,QUESTION 6,Section A – Poetry: stylistic analysis,Answer one question from this section. You should spend about one hour on this section.,6,,"Explore how Jacob Sam-La Rose presents ideas and feelings about the experience and impact of music in ‘After Lazerdrome, McDonalds, Peckham Rye’ and make connections with one or two other poems from your collection.

You should consider Sam-La Rose’s use of poetic and stylistic techniques and significant literary or other relevant contexts.",32,"‘After Lazerdrome, McDonalds, Peckham Rye’

What’s clear, now, is / that there was music, that it’s lasted, that it /
doesn’t matter whether a player played it, / or whether it just played itself /
that it still is / playing, / that at least two gods exist…
ABDULAH SIDRAN, ‘A Dispute About God’

where I say goodbye to south-east London for the next 3 years
a gaggle of us still damp spilling in from the night before
early flock for a Sunday six or seven a.m. sleepless
drowning in light and all this quiet after all that sweat
and darkness all that flighty noise

this is the year one of the guys says music is the one thing
that won’t ever let him down that music is his religion

the year we’re stopped and searched because we
fit the description the year jungle music passes
out of fashion stripped down

to naked beat and bass and we club together to dance
alone in the dark let the music play us meat and bone

let music fill the empty spaces rhythm in wads and scads
scattershot crashing wall to wall to be baptised
by filtered drums pressed snares and swollen b-lines

be baptised by city songs urban hymns seamless
sound a brimming sea of sound poured out

from towering speaker stacks this is the year we stand
close enough to feel the music rise its wing-beats
on our faces drawing salt from our skin released

then morning small fries and a strawberry milkshake
counting coins for the cab back sitting around a table

slouching in moulded seats drowning in silence
light-headed leavened waiting
for the right moment to move

awake for too long ears
still ringing drum-drunk

eyes still adjusting to the light
a weight coming down",,,,,Explore how Sam-La Rose presents ideas and feelings about the experience and impact of music.,,"[""Voice: 1st person fragmented narrative, continuous present tense."", ""Form: 12 stanzas of 2 or 3 lines, one extended, fragmented sentence. No punctuation, but mis-en-page denotes clauses. Varying lengths, mostly 12-15 syllables, contracting to 7 in stanza 10, and shortening further in the last two stanzas."", ""Imagery and Symbolism: Power of the primal experience: ‘stripped down’, ‘beat and bone’. The intense musical experience is depicted as a religious or ‘rite of passage’ practice: the imperative ‘let the music fill the empty spaces’ suggests immersion and subsequent personification of music with its ‘wing-beats’ implies an angelic or spiritual presence. Contrast between the intense build up and release and the enervated, ‘weighted down recovery the next morning."", ""Rhyme and Rhythm: No rhyme scheme, occasional internal rhyme (e.g. ‘wads and scads’). Shortening clauses and monosyllabic words increase pace and intensity through stanzas 5-8. Alliteration and sibilance intensifies the beat. The imperative ‘Let the music fill the empty spaces’ is central, heralding the most intense section. ‘Released’ at the end of stanza 8 is followed by lengthening clauses through the remaining stanzas, signalling the subsequent morning recovery."", ""Lexis: Words associated with: music, dancing, clubbing, concerts, gigs, rite of passage, religion, spirituality conflict, exercise, sweat, food, water, emotion, intensity, urban landscapes."", ""Grammar and Morphology: Continuous present tense. No punctuation exception for a contractual apostrophe. Disjointed statements. Repetition of ‘this is the year’ emphasising significance of the memory. Imperative use of ‘let’ in stanza 6. Some delayed verbs."", ""Context (AO3): a poem from a collection called ‘Breaking Silence’ which explores the experiences of fitting in and finding a voice in society."", ""Context (AO3): the poem fits into a literary tradition which explores the role of music in society, particularly as a unifier or as a means of expressing allegiance or identity."", ""Connections (AO4): ‘Make some Noise’ and 'Speechless II'""]",,,,32,,,
