exam_set_id,subject,year,grade,session,syllabus,question_paper_file_name,memo_file_name,group_id,group_title,group_instructions,question_id,parent_id,question_text,marks,scenario,context,options,match_data,guide_table,memo_question_text,marker_instruction,model_answers,sub_answers,essay_structure,memo_structured_answer,memo_marks,memo_max_marks,memo_notes,memo_topic
a8c8ee34-220d-4f36-8178-95c3c8594409,English Language and Literature (EMC),2019,A Level,MAY/JUNE,OCR A Level,OCR-A-Level-English-Language-and-Literature-Paper-2-QP.pdf,OCR-A-Level-English-Language-and-Literature-Paper-2-MS.pdf,QUESTION 1,Section A – Poetry: stylistic analysis,Answer one question from this section. You should spend about one hour on this section.,1,,"Explore how William Blake presents ideas about faith and hope in ‘The Chimney Sweeper’ (I) and make connections with one or two other poems from your collection.

You should consider Blake’s use of poetic and stylistic techniques and significant literary or other relevant contexts.",32,"‘The Chimney Sweeper’

When my mother died I was very young,
And my father sold me while yet my tongue,
Could scarcely cry weep weep weep weep.
So your chimneys I sweep & in soot I sleep.

Theres little Tom Dacre, who cried when his head
That curl’d like a lambs back, was shav’d, so I said,
Hush Tom never mind it, for when your head’s bare,
You know that the soot cannot spoil your white hair.

And so he was quiet, & that very night,
As Tom was a sleeping he had such a sight,
That thousands of sweepers Dick, Joe, Ned & Jack
Were all of them lock’d up in coffins of black,

And by came an Angel who had a bright key,
And he open’d the coffins & set them all free.
Then down a green plain leaping laughing they run
And wash in a river and shine in the Sun.

Then naked & white, all their bags left behind,
They rise upon clouds, and sport in the wind.
And the Angel told Tom, if he’d be a good boy,
He’d have God for his father & never want joy.

And so Tom awoke and we rose in the dark
And got with our bags & our brushes to work.
Tho’ the morning was cold, Tom was happy & warm.
So if all do their duty, they need not fear harm.",,,,,Explore how Blake presents ideas about faith and hope in ‘The Chimney Sweeper (I)’,"A response that does not address any one of the three assessment objectives targeted (AO1, AO2, AO3, AO4) cannot achieve all of the marks in the given level.","[""Voice: 1st person past tense narrative, moving to continuous present tense in the final stanza. Reported speech in the second stanza."", ""Form, structure: Dramatic monologue of 6 quatrains of 10 or 11 syllables, with a strong stress on the final syllable. Occasional enjambment between lines (stanzas 2, 4 and 6). Extended sentence between 3 and 4 stanza, containing the volta which contrasts the misery of the children with the sustaining hope of the dream."", ""Imagery and symbolism: Sharp contrast between daily misery of work and the dream ‘heaven’ where childhood can be briefly recovered – provided Tom is a ‘good boy’. Christian symbolism linking Tom Dacre to a ‘lamb’, strongly suggesting innocence and purity; also cleansing, cleanliness through washing away of literal and ‘spiritual’ dirt. An angel frees the children, possibly ironically symbolising the established church and the lack of practical aid offered on earth. Metaphor of ‘lock’d up in coffins of black’ for chimney (sweeping) emphasises the dark, dangerous and claustrophobic nature of the work."", ""Rhyme and rhythm: Anapestic rhyming couplets, lines vary between 8-12 syllables, emphasising child-like voice. Third lines of stanzas 2-6 are 10 or 11 syllables. ‘Sermonising’ effect suggests repetition of empty or unverified promises which only bring temporary comfort."", ""Lexis: Words associated with Christian faith, innocence, unhappiness, suffering, dirt, despair, child labour, work, escape, freedom, cleanliness, countryside, hope, faith."", ""Grammar and morphology: Near past tense, shifting to continuous present tense in the final stanza as the boys wake and resume work. Characteristic childlike simple syntax. Relatively controlled sentences throughout, frequent use of commas within and at end of lines. Stanza 2 is one long sentence. 1 extended sentence links stanzas 3 and 4, containing the volta. Contracted verbs in stanzas 2, 3 and 4. Sibilance is prominent in the first half."", ""Context (AO3): One of the darker ‘Innocence’ poems, ‘The Chimney Sweeper’ suggests that innocence will always be tainted by ‘real world’ experience. The heavenly ‘rural idyll’ which is a feature of many of the poems is but a dream and thus unobtainable."", ""Context (AO3): The poem highlights the issue of child labour, abuse and exploitation and the apparent hopelessness of their plight. The established church is also criticised for espousing blind faith in the hope of a better (after) life but offering little practical aid to the poor and needy."", ""Connections (AO4): ‘The Chimney Sweeper (E)’ and ‘London (E)’ and ‘The Nurse’s Song (I)’ may offer particular similarities and contrasts about how ideas of faith and hope are presented.""]",,,,32,,,
a8c8ee34-220d-4f36-8178-95c3c8594409,English Language and Literature (EMC),2019,A Level,MAY/JUNE,OCR A Level,OCR-A-Level-English-Language-and-Literature-Paper-2-QP.pdf,OCR-A-Level-English-Language-and-Literature-Paper-2-MS.pdf,QUESTION 10,Section B – Plays: dramatic and stylistic analysis,Answer one question from this section. You should spend about one hour on this section.,10,,"Explore how Friel presents Owen in this extract from Translations.

You should consider the use of dramatic and stylistic techniques in the extract, its significance within the play and any relevant dramatic or other contexts.",32,"Lancey: I see. Yes. Very well. Perhaps you’re right. Well. What we are doing is this. (He looks at OWEN. OWEN nods reassuringly) His Majesty’s government has ordered the first ever comprehensive survey of this entire country – a general triangulation which will embrace detailed hydrographic and topographic information and which will be executed to a scale of six inches to the English mile.
Hugh: (Pouring a drink) Excellent – excellent.
(LANCEY looks at OWEN.)
Owen: A new map is being made of the whole country.
(LANCEY looks to OWEN: Is that all? OWEN smiles reassuringly and indicates to proceed.)
Lancey: This enormous task has been embarked on so that the military authorities will be equipped with up-to-date and accurate information on every corner of this part of the Empire.
Owen: The job is being done by soldiers because they are skilled in this work.
Lancey: And also so that the entire basis of land valuation can be reassessed for purposes of more equitable taxation.
Owen: This new map will take the place of the estate agent’s map so that from now on you will know exactly what is yours in law.
Lancey: In conclusion I wish to quote two brief extracts from the white paper which is our governing charter: (Reads) ‘All former surveys of Ireland resulted in forfeiture and violent transfer of property; the present survey has for its object the relief which can be afforded to the proprietors and occupiers of land from unequal taxation.
Owen: The captain hopes that the public will cooperate with the sappers and that the new map will mean that taxes are reduced.
Hugh: A worthy enterprise – opus honestum! And Extract B?
Lancey: ‘Ireland is privileged. No such survey is being undertaken in England. So this survey cannot but be received as proof of the disposition of this government to advance the interests of Ireland.’ My sentiments too.
Owen: The survey demonstrates the government’s interest in Ireland and the captain thanks you for listening so attentively to him.
Hugh: Our pleasure, Captain.
Lancey: Lieutenant Yolland?
Yolland: I - I - I have nothing to say – really-
Owen: The captain is the man who actually makes the new map. George’s task is to see that the place-names on this map are…correct. (To YOLLAND) Just a few words – they’d like to hear from you. (To class) Don’t you want to hear George, too?
Maire: Has he anything to say?
Yolland: (To MAIRE) Sorry – sorry?
Owen: She says she is dying to hear from you.
Yolland: (To MAIRE) Very kind of you – thank you…(To class) I can only say that I feel – I feel very foolish to – to – to be working here and not to speak your language. But I intend to rectify that – with Roland’s help – indeed I do.
Owen: He wants me to teach him Irish!
Hugh: You are doubly welcome, sir.
Yolland: I think your countryside is – is – is – is very beautiful. I’ve fallen in love with it already. I hope we’re not too – too crude an intrusion on your lives. And I know that I’m going to be happy, very happy, here.
Owen: He is already a committed Hibernophile.
Jimmy: He loves –
Owen: Alright, Jimmy – we know – he loves Baile Beag; and he loves you all.
Hugh: Please…May I…?
(HUGH is now drunk. He holds on to the edge of the table.)
Owen: Go ahead, Father. (Hands up for quiet.) Please – please. 
Hugh: And we, gentlemen, we in turn are happy to offer you our friendship, our hospitality, and every assistance that you may require. Gentlemen – welcome!
(A few desultory claps. The formalities are over. General conversation. The soldiers meet the locals. MANUS and OWEN meet down stage.)
Owen: Lancey’s a bloody ramrod but George’s alright. How are you anyway?
Manus: What sort of a translation was that, Owen?
Owen: Did I make a mess of it?
Manus: You weren’t saying what Lancey was saying.
Owen: ‘Uncertainty in meaning is incipient poetry’ – who said that?
Manus: There was nothing uncertain about what Lancey said: it’s a bloody military operation, Owen! And what’s Yolland’s function? What’s ‘incorrect’ about the place-names we have here?
Owen: Nothing at all. They’re just going to be standardised.
Manus: You mean changed into English?
Owen: Where there’s ambiguity, they’ll be Anglicised.",,,,,Explore how Friel presents Owen in this extract from Translations.,,"[""Form and structure: the extract occurs at the end of Act 1 just after the arrival of the English soldiers. The motives for Owen/Rowland’s mis-translation of Lancey, and where his loyalties lie, are not yet clear. The strikingly different English voices of Lancey and Yolland evident here – the abrupt, authoritarian and condescending assertions of Lancey versus the hesitant diffidence of Yolland, both contrasting with the straightforwardness of Owen’s voice, temporarily ameliorating the threat from Lancey. The concluding confrontation between the brothers Owen and Manus, with Manus’ suggestion that Owen has previously shown the capacity for duplicity or manipulation, ‘It’s the same Owen’, foreshadows the destructive internecine conflicts of Act 3."", ""Dramatic techniques: the inability of the two English characters to understand any of the languages spoken other than English (Irish and Latin) stands representative of their, and their country’s, levels of ignorance of the culture and education of the Baile Beag residents. Yolland’s respect and diffidence seems initially attractive, yet it his naivety and idealisation of Gaelic culture that is the catalyst for the tragic events that occur, ‘I hope we’re not too – too crude an intrusion on your lives’. Manus, hitherto seen as passive and powerless in the face of Hugh’s braggadocio, presented at the end of the scene as being more perceptive and a stronger defender of his community than previously suspected. Owen’s role as peacemaker, ironic given his position as Lancey’s agent. Owen’s assertion that Owen/Roland is ‘only a name’ is tragically challenged as the play progresses."", ""Discourse: Conversation analysis e.g. Owen’s key role in ameliorating the threat implicit in Lancey’s statement evident in the statement/translation adjacency pairs; his subordinate role relative to Lancey inverted by his power of being the insider and polyglot. Lancey’s is the language of bureaucratic certitude while Owen’s hedges and softens. Yolland’s desire to interact hopelessly naive in light of Lancey’s statement of intent: hesitation, repetition and self-effacement from this reluctant colonialist, ‘sorry-sorry’, ‘I feel very foolish’. Cross cultural misunderstanding and mis-truth gives way to a shared understanding, albeit one characterised by conflict, between Owen/Manus via a shared language at the end of the scene."", ""Lexis: the language of technological and colonial power and control ‘…triangulation…executed to a scale of six inches to the English mile’ from Lancey stripped out in Owen’s translation, ‘a new map’. Hugh’s language of the genial host ‘…friendship’ hospitality’ and every assistance…’ concealing for the moment his real feelings under the guise of not understanding English. Informal, colloquial, mildly taboo language of Owen/Manus ‘bloody ramrod’, ‘bloody military operation’, ‘you bastards’, suggesting intimacy and real emotions."", ""Grammar and morphology: Complex declaratives from Lancey denoting his surety and obliviousness to the sensitivities of his audience. Interrogatives from Manus later as he seeks to interrogate Manus."", ""Figurative language and rhetorical features: strong contrasts in register between Lancey, Yolland, Hugh and Owen. Owen’s ‘real’ voice emerges in duologue with Manus – a symmetry in language choices between the brothers hints perhaps at shared values."", ""Context (AO3): the impact of the English intrusion into the seemingly timeless culture of Baile Beag dramatised here, yet it is the English desire to sentimentalise Ireland rather than the colonial intent to map the territory that is catalyst for the destruction of the community. The play is non-didactic in this regard, Maire’s desire to learn English is for her as legitimate a response ‘to mud cabins and a diet of potatoes’ as Hugh’s defence of the Irish language. The end of Act 1 here with the meeting of Maire and Yolland and their misplaced motives in commencing a relationship ultimately fractures the tense co-existence of England and Ireland and creates the context for tragedy.""]",,,,32,,,
a8c8ee34-220d-4f36-8178-95c3c8594409,English Language and Literature (EMC),2019,A Level,MAY/JUNE,OCR A Level,OCR-A-Level-English-Language-and-Literature-Paper-2-QP.pdf,OCR-A-Level-English-Language-and-Literature-Paper-2-MS.pdf,QUESTION 11,Section B – Plays: dramatic and stylistic analysis,Answer one question from this section. You should spend about one hour on this section.,11,,"Explore how Wertenbaker presents Mary and Dabby in this extract from Our Country’s Good.

You should consider the use of dramatic and stylistic techniques in the extract, its significance within the play and any relevant dramatic or other contexts.",32,"T Wertenbaker, 'Our Country's Good', pp29-31, Heinemann, 1991. [Item removed due to third party copyright restrictions.]",,,,,Explore how Wertenbaker presents Mary and Dabby in this extract from Our Country’s Good.,,"[""Form and structure: From Act 1 Scene 8, a scene reflecting on female experiences and perspectives as Dabby and Mary prepare for a rehearsal; characteristic of the play’s form, in two acts, each of eleven short scenes, which group some of the twenty-two characters together, in differently focused interactions; structure and development e.g. a range of topics covered – Dabby’s homesickness develops into reflections of Mary’s guilt over her sexual experiences on the journey to Australia; concluding with a discussion and reading of ‘The Recruiting Officer’."", ""Dramatic techniques: Stage directions and stage business e.g. play-within-a-play/meta-theatrical references, including the discussion and comparisons on acting and character and the reading from ‘The Recruiting Officer’; the lifting of Mary’s skirt suggesting Dabby’s intimate knowledge of Mary."", ""Discourse: Types of utterance e.g. a private conversation; conversation analysis e.g. change in power and dominance from Dabby in the first half to Mary in the second; length of turns; largely co-operative exchange; Mary’s interruptions and attempts to change the topic away from sex and Dabby’s subsequent attempt to change topic away from her prostituting Mary; register and style of language e.g. informal, idiomatic register, contrasting with the formality of ‘The Recruiting Officer’; Dabby’s derisive laugh ‘ha’."", ""Lexis: Lexical groups e.g. sex, religion, drama; significant word choices such as verb ‘drooling’, the contrasts between the nouns ‘whore’, ‘virgin’ and ‘martyr’; syndetic pair ‘brave and strong’; contrasts in Dabby/Mary’s and Farquhar’s use of language to describe sex."", ""Grammar and morphology: Sentence types e.g. imperatives ‘Dabby, don’t!’, ‘Listen, my darling…’; frequent simple sentences to reflect naturalistic speech; Dabby’s shocking complex sentence ‘While you were with your little sailor…’; contrast in the syntax of the quoted play and the conversation."", ""Figurative language and rhetorical features: Imagery e.g. ‘Devon rain is the softest in England’ as Dabby reflects on her home; patterning of similes ‘As soft as…’ contrasting with the horrors of their passage ‘biting like dogs’; patterning of ‘Men with…’; parallelism ‘That was different. That was love’; contrasting interpretations ‘whore’ and ‘martyr’; the symbolic role of language and the theatre."", ""Context (AO3): The dramatic context in which this extract occurs within the play e.g. the rehearsals of the play; Ralph and Mary’s relationship; references to home, anticipating Dabby’s plans to escape."", ""Context (AO3): Other relevant contexts e.g. attitudes towards women; religion; a developing female solidarity ‘We women have to look after each other’; Wertenbaker’s theatre work with prisoners; Keneally’s novel The Playmaker; the treatment of convicts.""]",,,,32,,,
a8c8ee34-220d-4f36-8178-95c3c8594409,English Language and Literature (EMC),2019,A Level,MAY/JUNE,OCR A Level,OCR-A-Level-English-Language-and-Literature-Paper-2-QP.pdf,OCR-A-Level-English-Language-and-Literature-Paper-2-MS.pdf,QUESTION 12,Section B – Plays: dramatic and stylistic analysis,Answer one question from this section. You should spend about one hour on this section.,12,,"Explore how Butterworth presents Johnny ‘Rooster’ Byron’s account of his birth in this extract from Jerusalem.

You should consider the use of dramatic and stylistic techniques in the extract, its significance within the play and any relevant dramatic or other contexts.",32,"Johnny: See, my father, Hector Byron, was a philanderer. Loves the lasses. One May morning, he says, ‘I’m off for a walk.’ Now, his wife, who knows his ways of old, tracks the old goat’s scent up the road, round the corner, straight up to the door of her own sweet sister. She crepples inside, up the stairs, into the boudoir, to find sister bent double on a big brass bed, with Hector up the back, in the cheap seats, whooping it up with all his lusty puff. The wife pulls a pistol, draws a bead and shoots the wayward lad slap-bang in the love bells. The bullet passes clean through his scrotum, bounces off the bedpost, zings out the window, down the high street to the crossroads, where it hits the number 87 tram to Andover. The bullet passes through two inches of rusty metal, clean through an elderly lady’s packed lunch and lodges in my sweet mother’s sixteen-year-old womb. Eight months, three weeks, six days later. Out pops him. Smiling. With a bullet clenched between his teeth.
Ginger: First of all. Babies don’t have teeth.
Johnny: All Byron boys are born with teeth. Thirty-two chompers. And hair on them’s chest. No wailing or weeping. Talkin’, straight off. This one – me – he sits up, wipes the dew from his eyes and calls, ‘Mother, what is this dark place?’ And she replied, ‘’Tis England, my boy. England.’ And with that, I jumps off the bed, and out the door, and off I marched in my little black cloak.
Ginger: Where did that come from?
Johnny: What?
Ginger: The cloak. Where did the cloak come from?
Johnny: All Byron boys come with their own cloaks. My brother Cyril’s was red. Frank’s was green. I’m born in black. With black eyes. You watch a black-cloaked Byron boy like a hawk, and tend him like a wound. You bind him, you swaddle him tight. And when they searched me –
Ginger: Wait. Stop. They searched you.
Johnny: Of course.
Ginger: Why did they search you?
Johnny: Always search a Byron boy at birth. You never know what he’s got on him. A Byron boy comes with three things. A cloak and a dagger, and his own teeth. He comes fully equipped. He doesn’t need nothing. And when he dies, he lies in the ground like a lump of granite. He don’t rot. There’s Byron boys buried all over this land, lying in the ground as fresh as the day they was planted. In them’s cloaks. With the teeth sharp. Fingernails sharp. And the two black eyes, staring out, sharp as spears. You get close and stare into those black eyes, watch out. Written there is old words that will shake you. Shake you down.
Ginger: Let’s get back to the bullet. Let’s go back to the bit where you were born on the tip of a speeding bullet.
Johnny: You don’t believe me.
He takes a bullet from his pocket. Tosses it to GINGER.
Ginger: Could be any old bullet.
He tosses it back.
Johnny: Any old bullet, eh? (He puts it between his teeth. Smiles.) So there you have it. I am the only man in history to be conceived in separate postal zones. Born one day early and I’ve been a day ahead of all you beggars ever since. (He smiles.)
All: Bollocks! Bullshit!",,,,,Explore how Butterworth presents Johnny ‘Rooster’ Byron’s account of his birth in this extract from Jerusalem.,,"[""Form and structure: Towards the beginning of Act 2; one of a number of examples of Johnny’s storytelling; narrative structure; Johnny is performing before a relatively large group of friends; Ginger’s sceptical interjections."", ""Dramatic techniques: Stage directions and stage business e.g. the throwing of the bullet; Johnny’s smiles; the comic, dramatic impact of Ginger’s disbelief."", ""Discourse: Types of utterance e.g. Johnny’s highly expressive and engaging narrative style; conversation analysis e.g. Johnny’s extended turns and the others yielding the floor; Ginger’s interruption ‘Wait’; repeated questions as Ginger attempts to quiz Johnny’s account; register and style of language e.g. Johnny’s characteristically colloquial, informal register."", ""Lexis: Taboo language and colloquialisms e.g. ‘lasses’, ‘slap-bang’, ‘beggars’, ‘Bollocks!’; repetition of ‘teeth’, ‘black’, ‘bullet’; lexical groups e.g. the body, violence; interesting verbs ‘zings’, ‘whooping’, ‘shake’ and the neologism ‘crepples’."", ""Grammar and morphology: Sentence types e.g. frequent ellipsis and minor sentences to imitate spontaneous speech, ‘Loves the lasses’, ‘Thirty-two chompers’; non-standard grammar and syntax e.g. ‘hair on them’s chest’, ‘I jumps’, ‘He don’t’; Ginger’s interrogatives; present tense."", ""Figurative language and rhetorical features: Johnny’s remarkable and suggestive figurative language e.g. metaphors ‘tracks the old goat’s scent’, ‘in the cheap seats’, ‘love bells’ and similes ‘like a wound’, ‘like a lump of granite’, ‘sharp as spears’; the associations of Byron boys with power/violence and a mythic England/the landscape."", ""Context (AO3): The context in which the extract occurs in the play e.g. the relationship between Johnny and Ginger; dancing and revelry preceding the passage; Johnny establishing himself as a legendary and violent figure; one of many stories told in the play."", ""Context (AO3): The context within the genre of drama e.g. mixing of realism and naturalistic dialogue with more magical and mythic ideas. Other relevant contexts e.g. an ‘origin’ myth; a modern version of a virgin birth.""]",,,,32,,,
