exam_set_id,subject,year,grade,session,syllabus,question_paper_file_name,memo_file_name,group_id,group_title,group_instructions,question_id,parent_id,question_text,marks,scenario,context,options,match_data,guide_table,memo_question_text,marker_instruction,model_answers,sub_answers,essay_structure,memo_structured_answer,memo_marks,memo_max_marks,memo_notes,memo_topic
a8c8ee34-220d-4f36-8178-95c3c8594409,English Language and Literature (EMC),2019,A Level,MAY/JUNE,OCR A Level,OCR-A-Level-English-Language-and-Literature-Paper-2-QP.pdf,OCR-A-Level-English-Language-and-Literature-Paper-2-MS.pdf,QUESTION 7,Section B – Plays: dramatic and stylistic analysis,Answer one question from this section. You should spend about one hour on this section.,7,,"Explore how Shakespeare presents Desdemona in this extract from Othello.

You should consider the use of dramatic and stylistic techniques in the extract, its significance within the play and any relevant dramatic or other contexts.",32,"Emilia: How goes it now? He looks gentler than he did.
Desdemona: He says he will return incontinent;
He hath commanded me to go to bed
And bade me to dismiss you.
Emilia: Dismiss me?
Desdemona: It was his bidding; therefore, good Emilia,
Give me my nightly wearing, and adieu.
We must not now displease him.
Emilia: I would you had never seen him.
Desdemona: So would not I: my love doth so approve him
That even his stubbornness, his checks, his frowns –
Prithee, unpin me – have grace and favour in them.
Emilia: I have laid those sheets you bade me on the bed.
Desdemona: All’s one. Good faith, how foolish are our minds!
If I do die before thee, prithee shroud me
In one of those same sheets.
Emilia: Come, come, you talk.
Desdemona: My mother had a maid called Barbary:
She was in love, and he she loved proved mad
And did forsake her. She had a song of willow;
An old thing ’twas but it expressed her fortune,
And she died singing it. That song tonight
Will not go from my mind. I have much to do
But to go hang my head all at one side
And sing it like poor Barbary – prithee, dispatch.
Emilia: Shall I go fetch your nightgown?
Desdemona: No, unpin me here.
This Lodovico is a proper man.
Emilia: A very handsome man.
Desdemona: He speaks well.
Emilia: I know a lady in Venice would have walked barefoot to Palestine
for a touch of his nether lip.
Desdemona: [Sings]
The poor soul sat sighing by a sycamore tree,
Sing all a green willow;
Her hand on her bosom, her head on her knee,
Sing willow, willow, willow;
The fresh streams ran by her and murmured her moans;
Sing willow, willow, willow.
Her salt tears fell from her and softened the stones –
Lay by these.
Sing willow, willow, willow –
Prithee, hie thee; he’ll come anon.
Sing all a green willow must be my garland.
Let nobody blame him; his scorn I approve –
Nay that’s not next. Hark, who is’t that knocks?
Emilia: It’s the wind.
Desdemona: [Sings]
I called my love false love, but what said he then?
Sing willow, willow, willow;
If I court moe women, you’ll couch with moe men –
So get thee gone; good night. Mine eyes do itch –
Does that bode weeping?
Emilia: ’Tis neither here nor there.
Desdemona: I have heard it said so. O, these men, these men!
Dost thou in conscience think – tell me, Emilia –
That there be women do abuse their husbands
In such gross kind?
Emilia: There be some such, no question.
Desdemona: Wouldst thou do such a deed for all the world?
Emilia: Why, would not you?
Desdemona: No, by this heavenly light.
Emilia: Nor I neither by this heavenly light;
I might do’t as well i’th’dark.
Desdemona: Wouldst thou do such a deed for all the world?
Emilia: The world’s a huge thing; it is a great price
For a small vice.
Desdemona: In troth, I think thou wouldst not.
Emilia: In troth, I think I should, and undo’t when I had done it. Marry, I would not do such a thing for a joint-ring, nor for measures of lawn, nor for gowns, petticoats, nor caps, nor any petty exhibition. But for all the whole world! Ud’s pity, who would not make her husband a cuckold, to make him a monarch? I should venture purgatory for’t.",,,,,Explore how Shakespeare presents Desdemona in this extract from Othello.,"A response that does not address any one of the three assessment objectives targeted (AO1, AO2, AO3) cannot achieve all of the marks in the given level.","[""Form and structure: Variations on blank verse, e.g. Desdemona’s song and Emila’s prose; Genre, e.g. the development of tragic pity for Desdemona; the development of the passage, as it progresses from Desdemona’s song to reflections on men and adultery."", ""Dramatic techniques: The significance of the domestic setting; Desdemona singing; dramatic irony (Othello has agreed to ‘strangle her in her bed’ in Act 4 Scene 1); implied stage directions as Emilia helps Desdemona to prepare for bed; the switch from blank verse to prose; the ominous sound of the wind, ‘who is’t that knocks?’; frequent foreshadowing, e.g. ‘If I do die…’"", ""Discourse: Types of utterance e.g. an intimate, private exchange between two women on the affairs of men; conversation analysis e.g. speech-in-action (‘I have laid those sheets…’) as Emilia prepares Desdemona for bed; some question and answer adjacency pairs; Emilia’s arch response to a question with another question, ‘Why, would not you?’; register and style of language e.g. shift in register to Emilia’s more earthly vocabulary in the second half of the passage, perhaps a contrast to Desdemona’s lyricism in her song; other noticeable features of discourse, e.g. Desdemona’s story."", ""Lexis: Lexical groups, e.g. romance and love, domestic items, sex and fidelity."", ""Grammar and morphology: Syntax, e.g. parallelism in the song and in ‘In troth…’; Sentence types, e.g. Desdemona’s status suggested in her imperatives; her comparative innocence suggested in her interrogatives (one of which is repeated); minor exclamative to suggest exasperation, ‘O, these men, these men!’; Emilia’s simple sentence ‘I should venture purgatory for’t’ and Desdemona’s ‘We must not now displease him’."", ""Figurative language and rhetorical features: A range of literary and poetic techniques in Desdemona’s song, e.g. sibilance, personification (‘murmured’), refrain, symbolism of the willow; punning contrast between ‘light’ and ‘dark’; frequent listing."", ""Context (AO3): The dramatic context in which this extract occurs within the play e.g. the tragic moments before Desdemona’s (and Emilia’s) death; Othello’s (and Iago’s) plan to ‘strangle her in her bed’; the wider concerns of love, sex and fidelity; Desdemona’s innocence and loyalty to her husband; Emilia’s song ‘Willow, willow, willow’ in her final speech."", ""Context (AO3): Literary and other relevant contexts e.g. contrasting attitudes towards marriage and fidelity; religious concerns of sin and purgatory; songs in Shakespearean theatre; patriarchy; tragic pity.""]",,,,32,,,
a8c8ee34-220d-4f36-8178-95c3c8594409,English Language and Literature (EMC),2019,A Level,MAY/JUNE,OCR A Level,OCR-A-Level-English-Language-and-Literature-Paper-2-QP.pdf,OCR-A-Level-English-Language-and-Literature-Paper-2-MS.pdf,QUESTION 8,Section B – Plays: dramatic and stylistic analysis,Answer one question from this section. You should spend about one hour on this section.,8,,"Explore how Wilde presents Lady Bracknell in this extract from The Importance of Being Earnest.

You should consider the use of dramatic and stylistic techniques in the extract, its significance within the play and any relevant dramatic or other contexts.",32,"Cecily: Mr Moncrieff and I are engaged to be married, Lady Bracknell.
Lady Bracknell: (with a shiver, crossing to the sofa and sitting down) I do not know whether there is anything peculiarly exciting in the air of this particular part of Hertfordshire, but the number of engagements that go on seems to me considerably above the proper average that statistics have laid down for our guidance. I think some preliminary enquiry on my part would not be out of place. Mr Worthing, is Miss Cardew at all connected with any of the larger railway stations in London? I merely desire information. Until yesterday I had no idea that there were any families or persons whose origin was a Terminus. (Jack looks perfectly furious, but restrains himself)
Jack: (in a clear, cold voice) Miss Cardew is the granddaughter of the late Mr Thomas Cardew of 149 Belgrave Square, S.W.; Gervase Park, Dorking, Surrey; and the Sporran, Fifeshire, N.B.
Lady Bracknell: That sounds not unsatisfactory. Three addresses always inspire confidence, even in tradesmen. But what proof have I of their authenticity?
Jack: I have carefully preserved the Court Guides of the period. They are open to your inspection, Lady Bracknell.
Lady Bracknell: (grimly) I have known strange errors in that publication.
Jack: Miss Cardew’s family solicitors are Messrs Markby, Markby, and Markby.
Lady Bracknell: Markby, Markby, and Markby? A firm of the very highest position in their profession. Indeed I am told that one of the Mr Markbys is occasionally to be seen at dinner parties. So far I am satisfied.
Jack: (very irritably) How extremely kind of you, Lady Bracknell! I have also in my possession, you will be pleased to hear, certificates of Miss Cardew’s birth, baptism, whooping cough, registration, vaccination, confirmation, and the measles; both the German and the English variety.
Lady Bracknell: Ah! A life crowded with incident, I see; though perhaps somewhat too exciting for a young girl. I am not myself in favour of premature experiences. (Rises, looks at her watch) Gwendolen! the time approaches for our departure. We have not a moment to lose. As a matter of form, Mr Worthing, I had better ask you if Miss Cardew has any little fortune?
Jack: Oh! about a hundred and thirty thousand pounds in the Funds. That is all. Good-bye, Lady Bracknell. So pleased to have seen you.
Lady Bracknell: (sitting down again) A moment, Mr Worthing. A hundred and thirty thousand pounds! And in the Funds! Miss Cardew seems to me a most attractive young lady, now that I look at her. Few girls of the present day have any really solid qualities, any of the qualities that last, and improve with time. We live, I regret to say, in an age of surfaces. (To Cecily) Come over here, dear. (Cecily goes across) Pretty child! your dress is sadly simple, and your hair seems almost as Nature might have left it. But we can soon alter all that. A thoroughly experienced French maid produces a really marvellous result in a very brief space of time. I remember recommending one to young Lady Lancing, and after three months her own husband did not know her.",,,,,Explore how Wilde presents Lady Bracknell in this extract from The Importance of Being Earnest.,,"[""Form and structure: Genre e.g. social comedy, satire; structure and development e.g. Lady Bracknell’s change of mind upon discovery of Cecily’s extensive fortune; Lady Bracknell’s extended speeches on engagements and Cecily."", ""Dramatic techniques: Stage directions and stage business e.g. Jack’s attempts to restrain his fury; Lady Bracknell’s rising and sitting to suggest her power and change of heart; Cecily’s contrasting obedience ‘Cecily goes across’; Algernon’s silence."", ""Discourse: Conversation analysis e.g. Lady Bracknell’s length of turns; Lady Bracknell sets the agenda, asks questions, etc.; Jack and Lady Bracknell both initiate leave taking; register e.g. typically formal register, with polite forms used to mask and deceive; ‘dear’ as a mode of address; exaggerated, non-naturalistic fluency."", ""Lexis: Lexical groups e.g. finance, law, fashion."", ""Grammar and morphology: Syntax e.g. fronted conjunction ‘But we can soon’ for comic reversal; sentence type e.g. frequent simple sentences for comic effect ‘I have known strange errors…’, ‘I am not myself in favour of…’; minor, exclamatory sentences as Lady Bracknell expresses joy at Cecily’s fortunes ‘A hundred and thirty thousand pounds!’; interrogative mood to suggest dominance; short exclamations, such as Jack’s dismissive ‘Oh!’ before he reveals Cecily’s fortune."", ""Figurative language and rhetorical features: Lady Bracknell’s aphorisms; periphrasis in Lady Bracknell’s first speech; paradox ‘origin was a Terminus’; frequent irony e.g. ‘We live, I regret to say, in an age of surfaces’, ‘A life crowded with incident’."", ""Pragmatics: Lady Bracknell’s implied displeasure at the news of the engagement at the beginning of the passage, ‘considerably above the proper average’; Lady Bracknell’s joy in exerting power over others; shared knowledge and understanding of social conventions."", ""Context (AO3): The context in which this extract occurs within the play e.g. the final act as the various complications, including those between Algy and Cecily, are resolved in marriage; Jack’s previous revelation to Lady Bracknell that he is engaged to be married to Gwendolen; Lady Bracknell’s discovery in Act 1 that Jack was found in a bag in Victoria Station."", ""Context (AO3): The context of performance and reception e.g. the changing social conventions of class and marriage; Lady Bracknell’s implied greed is satirised; Lady Bracknell as a stock character from a comedy of manners.""]",,,,32,,,
a8c8ee34-220d-4f36-8178-95c3c8594409,English Language and Literature (EMC),2019,A Level,MAY/JUNE,OCR A Level,OCR-A-Level-English-Language-and-Literature-Paper-2-QP.pdf,OCR-A-Level-English-Language-and-Literature-Paper-2-MS.pdf,QUESTION 9,Section B – Plays: dramatic and stylistic analysis,Answer one question from this section. You should spend about one hour on this section.,9,,"Explore how Williams presents differences in social status in this extract from A Streetcar Named Desire.

You should consider the use of dramatic and stylistic techniques in the extract, its significance within the play and any relevant dramatic or other contexts.",32,"T Williams, 'A Street Car Named Desire', pp76-78, Oxford University Press, 2009. [Item removed due to third party copyright restrictions.]",,,,,Explore how Williams presents differences in social status in this extract from A Streetcar Named Desire.,,"[""Form and structure: Genre e.g. setting up dramatic conflict and tragic pity for Blanche; structure and development e.g. the development of character contrasts and dramatic tension; other noticeable features of form and structure e.g. the attempts to lighten the mood followed by sudden violence."", ""Dramatic techniques: Dramatic irony e.g. the audience’s awareness of why Mitch has ‘stood up’ Blanche; stage directions e.g. the significance of the setting sun, its warmth contrasting with Blanche’s ‘dismal birthday supper’; characterisation e.g. Blanche’s attempts to conceal her feelings contrast with Stanley’s forthright outburst."", ""Discourse: types of utterance e.g. a domestic interactional conversation towards the end of a ‘dismal’ birthday supper; conversation analysis e.g. Blanche’s agenda setting and extended turns; Stella’s attempted face-saving ‘laughs feebly’ and face threatening ‘disgustingly greasy’; Stanley’s refusal to accept Blanche’s request to tell a joke and his initial taciturnity; register and style of language e.g. contrasting registers between Blanche and Stanley; naming and terms of address ‘beau’, ‘Mr. Kowalski’, ‘baby’; other noticeable features of discourse e.g. the joke itself is a comment on social propriety and language; oral narrative and the conventional structure of the joke."", ""Lexis: Lexical groups e.g. royalty, propriety/vulgarity; taboo ‘damn’ as the punch-line to the joke; violent dynamic verbs in the stage directions."", ""Grammar and morphology: Syntax e.g. the contrast between Blanche and Stanley’s structures; sentence type e.g. contrasting use of interrogatives, imperatives and exclamations; Stanley non-standard use of pronoun ‘them kind of words’."", ""Figurative language and rhetorical features: The suggested allegory in the joke, with Blanche as the old maid and Stanley as the parrot; imagery in the stage directions e.g. ‘still-golden dusk’; Blanche’s repetition of the imperative ‘tell us’; listing e.g. ‘“Pig – Polack – disgusting – vulgar – greasy”’; frequent use of irony e.g. ‘I don’t know any refined enough for your taste’."", ""Pragmatics: implied meanings, deixis, politeness e.g. Blanche’s joke is an implied criticism of Stanley’s impropriety; the violent implications behind Stanley’s polite interrogative ‘You want me to clear your places?’"", ""Context (AO3): The dramatic context in which this extract occurs within the play e.g. Stanley has just revealed the truth regarding Blanche’s circumstances in Laurel; the passage is preparing for the drama of Blanche’s birthday gift; the conflict throughout the play between characters from different social classes."", ""Context (AO3): The context within the genre of drama, or sub-genres e.g. tragedy, including pathos for Blanche; expressionism in the stage directions and the reference to the fading music; context of performance and reception e.g. domestic violence; attitudes towards immigration; the decline of the American South.""]",,,,32,,,
