exam_set_id,subject,year,grade,session,syllabus,question_paper_file_name,memo_file_name,group_id,group_title,group_instructions,question_id,parent_id,question_text,marks,scenario,context,options,match_data,guide_table,memo_question_text,marker_instruction,model_answers,sub_answers,essay_structure,memo_structured_answer,memo_marks,memo_max_marks,memo_notes,memo_topic
56a58b60-c098-4f4a-b570-27476b939d9f,A Level English Literature,2022,12,MAY/JUNE,OCR A Level,OCR-A-Level-English-Literature-Paper-1-June-2022-QP.pdf,OCR-A-Level-English-Literature-Paper-1-June-2022-MS.pdf,QUESTION 5,Section 1 – Shakespeare: The Tempest,Answer both parts (a) and (b).,5(a),5,"Discuss the following passage from Act 1 Scene 2, exploring Shakespeare’s use of language and its dramatic effects.",15,"PROSPERO This King of Naples, being an enemy 
To me inveterate, hearkens my brother’s suit; 
Which was, that he, in lieu o’ th’ premises. 
Of homage, and I know not how much tribute. 
Should presently extirpate me and mine 
Out of the dukedom, and confer fair Milan 
With all the honours on my brother. Whereon, 
A treacherous army levied, one midnight 
Fated to th’ purpose, did Antonio open 
The gates of Milan; and, i’ th’ dead of darkness, 
The ministers for th’ purpose hurried thence 
Me and thy crying self. 
MIRANDA Alack, for pity! 
I, not rememb’ring how I cried out then. 
Will cry it o’er again; it is a hint 
That wrings mine eyes to’t. 
PROSPERO Hear a little further, 
And then I’ll bring thee to the present business 
Which now’s upon ’s: without the which this story 
Were most impertinent. 
MIRANDA Wherefore did they not 
That hour destroy us? 
PROSPERO Well demanded, wench! 
My tale provokes that question. Dear, they durst not, 
So dear the love my people bore me; nor set 
A mark so bloody on the business; but 
With colours fairer painted their foul ends. 
In few, they hurried us aboard a bark; 
Bore us some leagues to sea, where they prepared 
A rotten carcass of a butt, not rigg’d, 
Nor tackle, sail, nor mast; the very rats 
Instinctively have quit it. There they hoist us. 
To cry to th’ sea, that roar’d to us; to sigh 
To th’ winds, whose pity, sighing back again, 
Did us but loving wrong. 
MIRANDA Alack, what trouble 
Was I then to you! 
PROSPERO O, a cherubin 
Thou wast that did preserve me! Thou didst smile. 
Infused with a fortitude from heaven, 
When I have deck’d the sea with drops full salt, 
Under my burden groan’d; which rais’d in me 
An undergoing stomach, to bear up 
Against what should ensue. 
MIRANDA How came we ashore? 
PROSPERO By Providence divine. 
Some food we had and some fresh water that 
A noble Neapolitan, Gonzalo, 
Out of his charity, who being then appointed 
Master of this design, did give us, with 
Rich garments, linens, stuffs, and necessaries. 
Which since have steaded much; so, of his gentleness. 
Knowing I lov’d my books, he furnish’d me 
From mine own library with volumes that 
I prize above my dukedom. 
MIRANDA Would I might 
But ever see that man! 
PROSPERO Now I arise. 
[Puts on his mantle. 
Sit still, and hear the last of our sea-sorrow. 
Here in this island we arriv’d; and here 
Have I, thy schoolmaster, made thee more profit 
Than other princess’ can, that have more time 
For vainer hours, and tutors not so careful. 
MIRANDA Heavens thank you for’t! And now, I pray you, sir, 
For still ’tis beating in my mind, your reason 
For raising this sea-storm? 
PROSPERO Know thus far forth: 
By accident most strange, bountiful Fortune, 
Now my dear lady, hath mine enemies 
Brought to this shore; and by my prescience 
I find my zenith doth depend upon 
A most auspicious star, whose influence 
If now I court not, but omit, my fortunes 
Will ever after droop.",,,,,The Tempest - Act 1 Scene 2 Passage Analysis,AO2 is dominant (75%). AO1 is 25%.,"[""Intimacy of the introductory scene between Miranda and Prospero."", ""Prospero clarifying narrative back-story for the audience's benefit."", ""Establishment of Antonio’s guilt, framing the play as a revenge drama."", ""Contrast between Act 1 Scene 1 (bustle) and Act 1 Scene 2 (calm rationality)."", ""Prospero’s role as teacher and controlling magician."", ""Miranda’s subservience and passivity (completing Prospero’s verse lines)."", ""Catechistic tone and atmosphere in the exchange.""]",,,,15,,,
56a58b60-c098-4f4a-b570-27476b939d9f,A Level English Literature,2022,12,MAY/JUNE,OCR A Level,OCR-A-Level-English-Literature-Paper-1-June-2022-QP.pdf,OCR-A-Level-English-Literature-Paper-1-June-2022-MS.pdf,QUESTION 5,Section 1 – Shakespeare: The Tempest,Answer both parts (a) and (b).,5(b),5,"‘The Tempest shows a fascination with the effects of cruelty and ruthlessness.’
Using your knowledge of the play as a whole, show how far you agree with this view of The Tempest. Remember to support your answer with reference to different interpretations.",15,,,,,,The Tempest - Cruelty and Ruthlessness,AO1 and AO5 are equally weighted (50% each).,"[""Responsibility for cruelty: Caliban (nature/nurture debate)."", ""Hardened courtly criminals: Antonio and Sebastian."", ""Distinction between 'cruelty' (pleasure in pain) and 'ruthlessness' (indifference to suffering)."", ""Play as a setting where human nature is put under a microscope."", ""Postcolonial theories regarding the treatment of indigenous characters."", ""Personalized responses justified by textual examples.""]",,,,15,,,
56a58b60-c098-4f4a-b570-27476b939d9f,A Level English Literature,2022,12,MAY/JUNE,OCR A Level,OCR-A-Level-English-Literature-Paper-1-June-2022-QP.pdf,OCR-A-Level-English-Literature-Paper-1-June-2022-MS.pdf,QUESTION 6,Section 1 – Shakespeare: Twelfth Night,Answer both parts (a) and (b).,6(a),6,"Discuss the following passage from Act 3 Scene 4, exploring Shakespeare’s use of language and its dramatic effects.",15,"Enter Officers. 
FABIAN O good Sir Toby, hold! Here come the officers. 
SIR TOBY [To Antonio] I’ll be with you anon. 
VIOLA Pray, sir, put your sword up, if you please. 
SIR ANDREW Marry, will I, sir; and for that I promis’d you, I’ll be as good as my word. He will bear you easily and reins well. 
1 OFFICER This is the man; do thy office. 
2 OFFICER Antonio, I arrest thee at the suit 
Of Count Orsino. 
ANTONIO You do mistake me, sir. 
1 OFFICER No, sir, no jot; I know your favour well, 
Though now you have no sea-cap on your head. 
Take him away; he knows I know him well. 
ANTONIO I must obey. [To Viola] This comes with seeking you; 
But there’s no remedy; I shall answer it. 
What will you do, now my necessity 
Makes me to ask you for my purse? It grieves me 
Much more for what I cannot do for you 
Than what befalls myself. You stand amaz’d; 
But be of comfort. 
2 OFFICER Come, sir, away. 
ANTONIO I must entreat of you some of that money. 
VIOLA What money, sir? 
For the fair kindness you have show’d me here, 
And part being prompted by your present trouble, 
Out of my lean and low ability 
I’ll lend you something. My having is not much; 
I’ll make division of my present with you; 
Hold, there’s half my coffer. 
ANTONIO Will you deny me now? 
Is’t possible that my deserts to you 
Can lack persuasion? Do not tempt my misery, 
Lest that it make me so unsound a man 
As to upbraid you with those kindnesses 
That I have done for you. 
VIOLA I know of none, 
Nor know I you by voice or any feature. 
I hate ingratitude more in a man 
Than lying, vainness, babbling drunkenness, 
Or any taint of vice whose strong corruption 
Inhabits our frail blood. 
ANTONIO O heavens themselves! 
2 OFFICER Come, sir, I pray you go. 
ANTONIO Let me speak a little. This youth that you see here 
I snatch’d one half out of the jaws of death, 
Reliev’d him with such sanctity of love, 
And to his image, which methought did promise 
Most venerable worth, did I devotion. 
1 OFFICER What’s that to us? The time goes by; away. 
ANTONIO But, O, how vile an idol proves this god! 
Thou hast, Sebastian, done good feature shame. 
In nature there’s no blemish but the mind: 
None can be call’d deform’d but the unkind. 
Virtue is beauty; but the beauteous evil 
Are empty trunks, o’erflourish’d by the devil. 
1 OFFICER The man grows mad. Away with him. 
Come, come, sir. 
ANTONIO Lead me on. [Exit with Officers.",,,,,Twelfth Night - Act 3 Scene 4 Passage Analysis,AO2 is dominant (75%). AO1 is 25%.,"[""Interruption of the duel between Viola (Cesario) and Sir Andrew by Antonio’s arrest."", ""Complexity of blocking involving a large number of characters."", ""Language of mistaken identity and confusion dominating the passage."", ""Antonio’s passionate and devoted character versus Viola’s valuation of 'ingratitude'."", ""Blunt professionalism of the Officers' interjections."", ""Atmosphere of urgency: short lines, exclamations, and misunderstandings."", ""Gender confusion: Viola in male disguise.""]",,,,15,,,
56a58b60-c098-4f4a-b570-27476b939d9f,A Level English Literature,2022,12,MAY/JUNE,OCR A Level,OCR-A-Level-English-Literature-Paper-1-June-2022-QP.pdf,OCR-A-Level-English-Literature-Paper-1-June-2022-MS.pdf,QUESTION 6,Section 1 – Shakespeare: Twelfth Night,Answer both parts (a) and (b).,6(b),6,"‘Mistaken identity in Twelfth Night is a source of both humour and suffering.’
Using your knowledge of the play as a whole, show how far you agree with this view of Twelfth Night. Remember to support your answer with reference to different interpretations.",15,,,,,,Twelfth Night - Humour and Suffering,AO1 and AO5 are equally weighted (50% each).,"[""Mistaken identity as a contributor to plot and thematic development."", ""Modern interpretations of Antonio’s devotion to Sebastian (e.g., closeted homosexuality)."", ""Malvolio’s disguise: amusing to audience but painful to character."", ""The 'mixed quality' of Shakespearean comedy (humour vs suffering)."", ""Identity conflicts involving gender."", ""Performance choices: single-sex, gender-reversed, or 'gender-blind' castings.""]",,,,15,,,
56a58b60-c098-4f4a-b570-27476b939d9f,A Level English Literature,2022,12,MAY/JUNE,OCR A Level,OCR-A-Level-English-Literature-Paper-1-June-2022-QP.pdf,OCR-A-Level-English-Literature-Paper-1-June-2022-MS.pdf,QUESTION 7,Section 2 – Drama and Poetry pre-1900,"Answer one question from this section. You should spend about 1 hour and 15 minutes on this section. In your answer, you should refer to one drama text and one poetry text from the following lists: 
Drama: 
- Christopher Marlowe: Edward II 
- John Webster: The Duchess of Malfi 
- Oliver Goldsmith: She Stoops to Conquer 
- Henrik Ibsen: A Doll’s House 
- Oscar Wilde: An Ideal Husband 
Poetry: 
- Geoffrey Chaucer: The Merchant’s Prologue and Tale 
- John Milton: Paradise Lost Books 9 & 10 
- Samuel Taylor Coleridge: Selected Poems 
- Alfred, Lord Tennyson: Maud 
- Christina Rossetti: Selected Poems",7,,"‘Literature shows that the cleverest people do not always make the wisest choices.’
In the light of this view, consider ways in which writers explore the relationship between characters’ intellect and their judgement. In your answer, compare one drama text and one poetry text from the above lists.",30,,,,,,,,,,"{""conclusion"": [""Relationship between intellect and judgment varies across genres, often showing a disconnect.""], ""introduction"": [""Literature shows that clever people do not always make the wisest choices."", ""Exploration of the relationship between characters' intellect and judgement.""], ""body_sections"": [{""points"": [""Edward II: Intelligence does not help the King with public role decisions."", ""The Duchess of Malfi: Bosola’s brains are employed in dubious exploits."", ""She Stoops to Conquer: Clever interlopers end in scrapes; the wise character is the fool Tony Lumpkin."", ""A Doll’s House: Nora makes mistakes initially but grows wiser than her husband."", ""An Ideal Husband: Intelligent people get into unwise scrapes on their route to success.""], ""sub_topic"": ""Drama Texts""}, {""points"": [""The Merchant’s Prologue and Tale: No link between age and intelligence; cynical view of wisdom."", ""Paradise Lost: Satan’s high intelligence leads to damnation; Adam and Eve's negative decision."", ""Coleridge: Wise contemplation preferred over philosophic enquiry; Ancient Mariner repents a single decision."", ""Tennyson’s Maud: Intelligent speculations end in deep unhappiness."", ""Rossetti: Wisdom of God vs. foolishness of human intellectual conceit.""], ""sub_topic"": ""Poetry Texts""}]}",,,,,Intellect and Judgement (Drama and Poetry pre-1900)
56a58b60-c098-4f4a-b570-27476b939d9f,A Level English Literature,2022,12,MAY/JUNE,OCR A Level,OCR-A-Level-English-Literature-Paper-1-June-2022-QP.pdf,OCR-A-Level-English-Literature-Paper-1-June-2022-MS.pdf,QUESTION 8,Section 2 – Drama and Poetry pre-1900,(Same instructions as Question 7),8,,"‘Literature has more to say about social structures than about the natural world.’
In the light of this view, consider ways in which writers explore the relationship between the natural environment and human societies. In your answer, compare one drama text and one poetry text from the above lists.",30,,,,,,,,,,"{""conclusion"": [""Balance between societal commentary and environmental presence.""], ""introduction"": [""Literature has more to say about social structures than about the natural world.""], ""body_sections"": [{""points"": [""Edward II / Duchess of Malfi: Human intrigue and social structures as core interest."", ""She Stoops to Conquer: Fashionable society confronts the Pastoral world."", ""A Doll’s House: Set in rural Norway but focused on social action."", ""Wilde: An artificial world where nature is largely irrelevant (buttonholes and house-plants).""], ""sub_topic"": ""Drama Texts""}, {""points"": [""Merchant’s Tale: Januarie’s symbolic, self-contained garden as backdrop for intrigue."", ""Paradise Lost: The Garden of Eden as a setting for social interaction."", ""Coleridge: Nature dominates 'conversation' and teaches lessons."", ""Maud: Natural settings as a projection of the narrator's mind."", ""Rossetti: Natural settings representing the limitations of a 'fallen' world.""], ""sub_topic"": ""Poetry Texts""}]}",,,,,Social Structures vs. Natural World
56a58b60-c098-4f4a-b570-27476b939d9f,A Level English Literature,2022,12,MAY/JUNE,OCR A Level,OCR-A-Level-English-Literature-Paper-1-June-2022-QP.pdf,OCR-A-Level-English-Literature-Paper-1-June-2022-MS.pdf,QUESTION 9,Section 2 – Drama and Poetry pre-1900,(Same instructions as Question 7),9,,"‘Powerful emotions are often the excuse for unacceptable behaviour.’
In the light of this view, consider ways in which writers explore the connection between intense thoughts and bad deeds. In your answer, compare one drama text and one poetry text from the above lists.",30,,,,,,,,,,"{""conclusion"": [""Emotions serve as both a catalyst for action and a justification for transgressions.""], ""introduction"": [""Powerful emotions are often the excuse for unacceptable behaviour.""], ""body_sections"": [{""points"": [""Edward II: The King is ruled by emotions leading to unacceptable results."", ""Duchess of Malfi: Repressed emotions drive characters to unacceptable behaviour."", ""She Stoops to Conquer: Emotions goad characters into crossing social boundaries."", ""A Doll’s House: Nora's emotions as the driving force deemed 'unacceptable' by husband.""], ""sub_topic"": ""Drama Texts""}, {""points"": [""Merchant’s Tale: Januarie fits the template of emotions driving deeds."", ""Paradise Lost: Independence, love, and pride leading to the Fall."", ""Coleridge: Power of emotions as a celebrated Romantic ideal vs condemnation."", ""Maud: Dangers of unchecked emotions vs the insights they bring."", ""Rossetti: Verse often condemns strong emotions as missing their object.""], ""sub_topic"": ""Poetry Texts""}]}",,,,,Powerful Emotions and Unacceptable Behaviour
